stimulus,he,she
"Miss Smith corrected Mr. Smith and, as a result,",0.503391444683075,0.49660855531692505
"The woman corrected the man and, as a result,",0.5681041479110718,0.43189582228660583
"Mary corrected John and, as a result,",0.4708561301231384,0.5291438698768616
"Alice corrected Bob and, as a result,",0.7394850850105286,0.26051491498947144
"The actress corrected the actor and, as a result,",0.8103736042976379,0.18962647020816803
"The girl corrected the boy and, as a result,",0.6204594373703003,0.3795405328273773
"Mrs. Taylor corrected Mr. Williams and, as a result,",0.4159127473831177,0.5840871930122375
"Emma corrected David and, as a result,",0.47057005763053894,0.5294299721717834
"The princess corrected the prince and, as a result,",0.5141354203224182,0.4858646094799042
"Sarah corrected Robert and, as a result,",0.7586456537246704,0.24135439097881317
"Mrs. Williams corrected Mr. Taylor and, as a result,",0.415283203125,0.584716796875
"Emily corrected Paul and, as a result,",0.4873219132423401,0.5126780271530151
"Mr. Smith corrected Miss Smith and, as a result,",0.6707732081413269,0.3292267918586731
"The man corrected the woman and, as a result,",0.5800071358680725,0.41999292373657227
"John corrected Mary and, as a result,",0.6925237774848938,0.3074761927127838
"Bob corrected Alice and, as a result,",0.7927353382110596,0.207264706492424
"The actor corrected the actress and, as a result,",0.6723107099533081,0.3276893198490143
"The boy corrected the girl and, as a result,",0.72602778673172,0.27397215366363525
"Mr. William corrected Mrs. Taylor and, as a result,",0.4990572929382324,0.5009427070617676
"David corrected Emma and, as a result,",0.6165196895599365,0.3834803104400635
"The prince corrected the princess and, as a result,",0.42805036902427673,0.5719496607780457
"Robert corrected Sarah and, as a result,",0.721824586391449,0.278175413608551
"Mr. Taylor corrected Mrs. Williams and, as a result,",0.49945664405822754,0.5005433559417725
"Paul corrected Emily and, as a result,",0.6457021832466125,0.35429778695106506
